{
  "$schema": "../schemas/agentic-zero-trust-catalog.schema.json",
  "version": "0.1.0",
  "principle": "Agentic systems earn trust continuously through verified identity, just-in-time credentials, least privilege, registry trust, policy enforcement, sandboxing, immutable traces, human control, adversarial evaluation, and incident response.",
  "zero_trust_controls": [
    {
      "id": "agent_nhi_registry",
      "name": "Agent and Non-Human Identity Registry",
      "purpose": "Assign every agent, sub-agent, routine, service account, and tool runner a unique identity with actor-chain attribution.",
      "keywords": ["identity", "non-human identity", "nhi", "agent identity", "service account", "sub-agent", "actor chain", "impersonation", "principal", "tenant"],
      "threats": ["unattributed action", "agent impersonation", "sub-agent escalation", "tenant-boundary confusion"],
      "required_outputs": ["agent identity inventory", "service account inventory", "actor-chain schema", "tenant/workspace boundary", "impersonation rule", "revocation rule"],
      "p0_blockers": ["agentic action cannot be attributed to user, tenant, agent, and credential", "sub-agents can act without registered identity", "tenant boundary is unclear"]
    },
    {
      "id": "jit_vault_credentials",
      "name": "JIT Credential Broker and Vault",
      "purpose": "Issue short-lived scoped credentials from a vault or broker only at the moment a verified action needs them.",
      "keywords": ["credential", "secret", "api key", "oauth", "token", "vault", "broker", "just in time", "jit", "rotation", "revocation", "scope", "expiry"],
      "threats": ["credential theft", "overbroad token", "static secret leakage", "privilege escalation"],
      "required_outputs": ["vault or broker choice", "credential checkout flow", "scope and expiry matrix", "rotation policy", "revocation policy", "secret scanning policy"],
      "p0_blockers": ["long-lived broad credentials are available to agents", "secrets are stored in prompts, skill files, repo config, or client code", "credential revocation path is missing"]
    },
    {
      "id": "per_action_authorization",
      "name": "Per-Action Authorization and Intent Verification",
      "purpose": "Authorize every sensitive action against user intent, task scope, agent role, policy, risk, credential scope, and approval threshold.",
      "keywords": ["authorization", "intent", "policy", "approval", "public", "paid", "destructive", "send", "publish", "delete", "spend", "confused deputy"],
      "threats": ["excessive agency", "confused deputy", "unauthorized action", "policy bypass"],
      "required_outputs": ["action authorization matrix", "risk thresholds", "policy decision owner", "approval event schema", "denial/refusal behavior", "confused-deputy control"],
      "p0_blockers": ["public, paid, destructive, or compliance-sensitive actions can run without per-action authorization", "approval thresholds are undefined", "agent can act outside current user intent"]
    },
    {
      "id": "trusted_registry",
      "name": "Tool, MCP, Skill, Agent Card, and Model Registry",
      "purpose": "Vett and version the supply chain of tools, MCP servers, connectors, skills, harnesses, agent cards, models, prompts, and policy bundles.",
      "keywords": ["tool registry", "mcp", "connector", "plugin", "skill", "agent card", "model", "prompt", "supply chain", "version", "checksum", "pinning", "provenance"],
      "threats": ["tool poisoning", "MCP server compromise", "skill malware", "agent-card spoofing", "model supply-chain compromise"],
      "required_outputs": ["approved capability registry", "owner/version fields", "allowed operations", "provenance or pinning policy", "review cadence", "quarantine/removal path"],
      "p0_blockers": ["unreviewed tools, MCP servers, skills, models, or agent cards can be used in launch-critical flows", "tool capabilities are broader than the agent task", "no owner or version exists for privileged tool surfaces"]
    },
    {
      "id": "ai_gateway_policy",
      "name": "AI Gateway, Firewall, and Policy Enforcement",
      "purpose": "Enforce deterministic checks around model inputs, retrieved context, tool inputs, model outputs, egress, and delegated payloads.",
      "keywords": ["ai gateway", "ai firewall", "policy enforcement", "guardrail", "prompt injection", "indirect prompt injection", "output filter", "dlp", "egress", "validation"],
      "threats": ["prompt injection", "indirect prompt injection", "data exfiltration", "unsafe tool input", "policy bypass"],
      "required_outputs": ["input controls", "retrieved-context labeling", "tool input validation", "output DLP filters", "egress allowlist", "unsafe action refusal path"],
      "p0_blockers": ["model output directly drives privileged tool calls without validation", "untrusted retrieved content is not labeled or constrained", "sensitive output can leave through uncontrolled egress"]
    },
    {
      "id": "data_memory_model_integrity",
      "name": "Data, Memory, Retrieval, and Model Integrity",
      "purpose": "Protect the sources that shape decisions: memories, RAG indexes, embeddings, policies, preferences, eval sets, fine-tuning data, and model artifacts.",
      "keywords": ["memory", "rag", "retrieval", "embedding", "vector", "policy", "preference", "poisoning", "data poisoning", "model poisoning", "provenance", "quarantine", "eval set"],
      "threats": ["memory poisoning", "data poisoning", "model poisoning", "vector weakness", "stale or forged source", "policy tampering"],
      "required_outputs": ["source provenance model", "ingestion trust tiers", "quarantine workflow", "memory correction/delete/export propagation", "index rebuild policy", "eval-set integrity checks"],
      "p0_blockers": ["retrieved context or memory can be trusted without provenance", "policies or preferences can be tampered with silently", "poisoned sources cannot be quarantined or rolled back"]
    },
    {
      "id": "micro_sandbox_segmentation",
      "name": "Micro-Sandboxing and Segmentation",
      "purpose": "Constrain agents by file path, network destination, database scope, tenant data, tool operation, subprocess, browser state, and production mutation boundary.",
      "keywords": ["sandbox", "segmentation", "egress", "allowlist", "file", "network", "database", "rls", "tenant isolation", "browser state", "computer use", "subprocess"],
      "threats": ["lateral movement", "tenant escape", "production mutation", "unbounded file access", "network exfiltration"],
      "required_outputs": ["per-agent sandbox policy", "file/network/database allowlists", "tenant segmentation rule", "egress filtering", "local execution boundary", "production mutation boundary"],
      "p0_blockers": ["agents can access broad filesystem, network, or tenant scopes without need", "tool runners can mutate production without boundary", "browser or Computer Use state is not isolated for sensitive workflows"]
    },
    {
      "id": "immutable_observability",
      "name": "Immutable Observability and Forensic Trace",
      "purpose": "Record tamper-evident evidence for prompts, context, retrieval, memory, model route, policy, credential checkout, tool calls, approvals, and external actions.",
      "keywords": ["immutable", "observability", "trace", "audit", "forensic", "tamper", "log", "correlation", "replay", "credential checkout", "approval", "tool call"],
      "threats": ["missing forensic evidence", "log tampering", "unreconstructable action", "repudiation"],
      "required_outputs": ["trace event taxonomy", "correlation ID strategy", "tamper-evident log target", "retention policy", "sensitive-log redaction", "replay/debug path"],
      "p0_blockers": ["bad agent outcome cannot be reconstructed", "credential checkout or approval events are not logged", "privileged logs are mutable without tamper controls"]
    },
    {
      "id": "human_control_kill_switch",
      "name": "Human Control, Kill Switch, Throttles, and Canaries",
      "purpose": "Give humans practical controls to approve, pause, stop, revoke, throttle, canary, roll back, and investigate agentic behavior.",
      "keywords": ["human in the loop", "kill switch", "pause", "stop", "revoke", "throttle", "rate limit", "spend limit", "canary", "rollback", "approval queue"],
      "threats": ["runaway autonomy", "cost runaway", "rapid repeated harm", "unsafe rollout"],
      "required_outputs": ["kill switch", "pause/stop/revoke controls", "rate/spend/action limits", "approval queue", "canary rollout plan", "rollback playbook"],
      "p0_blockers": ["no kill switch exists for autonomous routines", "paid or public actions have no throttle", "unsafe rollout cannot be paused or rolled back"]
    },
    {
      "id": "continuous_verification",
      "name": "Continuous Verification and Scanning",
      "purpose": "Continuously verify secrets, dependencies, MCP servers, skills, tool schemas, memory sources, retrieval indexes, policy drift, access scopes, logs, and deployed surfaces.",
      "keywords": ["scan", "scanning", "continuous verification", "drift", "secret scan", "dependency", "mcp scan", "policy drift", "access review", "red team"],
      "threats": ["security drift", "new vulnerable dependency", "stale access", "unreviewed tool change"],
      "required_outputs": ["scan schedule", "drift checks", "red-team cadence", "model/tool/memory change review", "credential hygiene checks", "incident review trigger"],
      "p0_blockers": ["privileged agentic system has no periodic access review", "tool or policy changes bypass review", "secret scanning is missing for repos with credentials"]
    },
    {
      "id": "adversarial_evals",
      "name": "Adversarial Evaluation and Attack Simulation",